<?xml version="1.0" encoding="UTF-8"?>
<meiQiReferrer xmlns:xsi="http://www.w3.org/2001/XMLSchema-instance" xsi:noNamespaceSchemaLocation="userCenter.xsd">
  <sections>
		<sectionName>DesignerInfoSection</sectionName>
		<sectionItems>
			<viewName>DesignerInfoCell</viewName>
			<data>
			    <lbldesignerImgvLabel>${DesignerInfo.imagv}</lbldesignerImgvLabel>
				<lbldesignerNameLabel>${DesignerInfo.name}</lbldesignerNameLabel>
				<lbldesignerCompanyLabel>${DesignerInfo.company}</lbldesignerCompanyLabel>
				<imgIdentification>已认证图标</imgIdentification>
			</data>
		<actions>
				<actionName>designerInfoCommand</actionName>
				<sender>DesignerInfoCell</sender>
				<actionValue></actionValue>
			</actions>
			<actions/>
		</sectionItems>
	   <sectionItems>
			<viewName>CommissionCell</viewName>
			<data>
			    <lblTime>${DesignerInfo.commission.newIncomeTime}</lblTime>
			    <lblHistoryIncome>${DesignerInfo.commission.historyIncome}</lblHistoryIncome>
			    <lblNotCheckoutPrice>${DesignerInfo.commission.notCheckoutPrice}</lblNotCheckoutPrice>
			    <lblNewIncome>${DesignerInfo.commission.newIncome}</lblNewIncome>
			    <btnCheckoutKnows>结算须知</btnCheckoutKnows>
			</data>
			<actions>
				<actionName>checkoutKnowsCommand</actionName>
				<sender>btnCheckoutKnows</sender>
				<actionValue></actionValue>
			</actions>
			<actions/>
		</sectionItems>
  </sections>
  <sections>
		<sectionName>NormalSection</sectionName>
		<sectionItems>
			<viewName>NormalCell</viewName>
			<data>
				<lblTitle>佣金明细</lblTitle>
				<imgLogo>收益图标</imgLogo>
			</data>
		<actions>
				<actionName>commissionDetailsCommand</actionName>
				<sender>NormalCell</sender>
				<actionValue></actionValue>
			</actions>
			<actions/>
			</sectionItems>
		<sectionItems/>
	</sections>
	<sections>
		<sectionName>NormalSection</sectionName>
		<sectionItems>
			<viewName>NormalCell</viewName>
			<data>
				<lblTitle>我收藏的商品</lblTitle>
				<imgLogo>收藏图标</imgLogo>
			</data>
			<actions>
				<actionName>myCollectionCommand</actionName>
				<sender>NormalCell</sender>
				<actionValue></actionValue>
			</actions>
			<actions/>
		</sectionItems>
		<sectionItems/>
	</sections>
	<sections>
		<sectionName>NormalSection</sectionName>
		<sectionItems>
			<viewName>NormalCell</viewName>
			<data>
				<lblTitle>设置</lblTitle>
				<imgLogo>设置图标</imgLogo>
			</data>
		<actions>
				<actionName>settingsCommand</actionName>
				<sender>NormalCell</sender>
				<actionValue></actionValue>
			</actions>
			<actions/>
			</sectionItems>
		<sectionItems/>
	</sections>	
	<sections>
		<sectionName>NormalSection</sectionName>
		<sectionItems>
			<viewName>NormalCell</viewName>
			<data>
				<lblTitle>关于乐家购</lblTitle>
				<imgLogo>关于图标</imgLogo>
			</data>
		<actions>
				<actionName>aboutUsCommand</actionName>
				<sender>NormalCell</sender>
				<actionValue></actionValue>
			</actions>
			<actions/>
		</sectionItems>
		<sectionItems/>
	</sections>
</meiQiReferrer>