<?xml version="1.0" encoding="UTF-8"?>
<meiQiReferrer xmlns:xsi="http://www.w3.org/2001/XMLSchema-instance" xsi:noNamespaceSchemaLocation="userCenter.xsd">
  <sections>
		<sectionName>ResidentForNOSection</sectionName>
		<sectionItems>
			<viewName>ResidentForNOCell</viewName>
			<data>
				<lblStatus>抱歉，您的入驻申请未通过审核！</lblStatus>
			</data>
		<actions>
				<actionName>processStatusCommand</actionName>
				<sender>ResidentForNOCell</sender>
				<actionValue>${ApplyEntryLog.url}</actionValue>
			</actions>
			<actions/>
			</sectionItems>
			<sectionItems/>
	</sections>
  <sections>
	<sectionName>NormalSection</sectionName>
		<sectionItems>
			<viewName>NormalCell</viewName>
			<data>
				<lblTitle>我的订单</lblTitle>
				<imgLogo>订单图标1</imgLogo>
			</data>
		<actions>
				<actionName>myOrderCommand</actionName>
				<sender>NormalCell</sender>
				<actionValue>YES</actionValue>
			</actions>
			<actions/>
			</sectionItems>
		<sectionItems>
			<viewName>NormalCell</viewName>
			<data>
				<lblTitle>订单查询</lblTitle>
				<imgLogo>订单查询图标</imgLogo>
			</data>
			<actions>
				<actionName>orderQueryCommand</actionName>
				<sender>NormalCell</sender>
				<actionValue></actionValue>
			</actions>
			<actions/>
		</sectionItems>
  </sections>
  <sections>
       <sectionName>NormalSection</sectionName>
		<sectionItems>
			<viewName>NormalCell</viewName>
			<data>
				<lblTitle>我收藏的商品</lblTitle>
				<imgLogo>收藏图标</imgLogo>
			</data>
			<actions>
				<actionName>myCollectionCommand</actionName>
				<sender>NormalCell</sender>
				<actionValue></actionValue>
			</actions>
			<actions/>
		</sectionItems>
		<sectionItems/>
  </sections>
	<sections>
		<sectionName>NormalSection</sectionName>
		<sectionItems>
			<viewName>NormalCell</viewName>
			<data>
				<lblTitle>关于乐家购</lblTitle>
				<imgLogo>关于图标</imgLogo>
			</data>
		<actions>
				<actionName>aboutUsCommand</actionName>
				<sender>NormalCell</sender>
				<actionValue></actionValue>
			</actions>
			<actions/>
		</sectionItems>
		<sectionItems/>
	</sections>
</meiQiReferrer>