<?xml version="1.0" encoding="UTF-8"?>
<meiQiReferrer xmlns:xsi="http://www.w3.org/2001/XMLSchema-instance" xsi:noNamespaceSchemaLocation="userCenter.xsd">
  <sections>
		<sectionName>ResidentForYESSection</sectionName>
		<sectionItems>
			<viewName>ResidentForYESCell</viewName>
			<data>
				<lblStatus>您已成功入驻乐家购！</lblStatus>
				<lblDescribe>点击立即登录</lblDescribe>
			</data>
		<actions>
				<actionName>succeedStatusCommand</actionName>
				<sender>ResidentForYESCell</sender>
				<actionValue>${ApplyEntryLog.url}</actionValue>
			</actions>
			<actions/>
			</sectionItems>
		<sectionItems/>
	</sections>
	<sections>
		<sectionName>NormalSection</sectionName>
		<sectionItems>
			<viewName>NormalCell</viewName>
			<data>
				<lblTitle>我的订单</lblTitle>
				<imgLogo>ic40</imgLogo>
			</data>
		<actions>
				<actionName>myOrderCommand</actionName>
				<sender>NormalCell</sender>
				<actionValue></actionValue>
			</actions>
			<actions/>
		</sectionItems>
	    <sectionItems>
			<viewName>NormalCell</viewName>
			<data>
				<lblTitle>订单查询</lblTitle>
				<imgLogo>ic41</imgLogo>
			</data>
			<actions>
				<actionName>orderQueryCommand</actionName>
				<sender>NormalCell</sender>
				<actionValue></actionValue>
			</actions>
			<actions/>
		</sectionItems>
	</sections>
	<sections>
	    <sectionName>NormalSection</sectionName>
	    <sectionItems>
			<viewName>NormalCell</viewName>
			<data>
				<lblTitle>我收藏的商品</lblTitle>
				<imgLogo>ic24</imgLogo>
			</data>
			<actions>
				<actionName>myCollectionCommand</actionName>
				<sender>NormalCell</sender>
				<actionValue></actionValue>
			</actions>
			<actions/>
		</sectionItems>
		<sectionItems/>
	</sections>	
	<sections>
		<sectionName>NormalSection</sectionName>
		<sectionItems>
			<viewName>NormalCell</viewName>
			<data>
				<lblTitle>关于乐家购</lblTitle>
				<imgLogo>ic39</imgLogo>
			</data>
		<actions>
				<actionName>aboutUsCommand</actionName>
				<sender>NormalCell</sender>
				<actionValue></actionValue>
			</actions>
			<actions/>
		</sectionItems>
		<sectionItems/>
	</sections>
</meiQiReferrer>

